{
  "evidenceSchemaVersion": "1.0",
  "kind": "CUTOVER_VALIDATION",
  "status": "CURRENT",
  "recordedAt": "2026-09-05T08:46:50Z",
  "bindings": {
    "commit": "4b9b946ca12562900684fe5d2d7106d7f38d08e7"
  },
  "observations": {
    "readOnlyReconciliation": true,
    "github": {
      "pullRequests": [
        { "number": 23, "mergeCommit": "0bf4012d16a74361500dad806d120a556fbbfd9b", "status": "MERGED" },
        { "number": 24, "mergeCommit": "fbc68a9f0e02923880c8a06162a8d7cda2afac38", "status": "MERGED" }
      ],
      "developmentRun": { "number": 33457927112, "commit": "fbc68a9f0e02923880c8a06162a8d7cda2afac38", "status": "SUCCESS" }
    },
    "historicalDeploymentRuns": [
      { "number": 33066467680, "branch": "test", "commit": "bbfcbe4f792790703a877a02f2941cfada61d6ae", "status": "SUCCESS" },
      { "number": 33381147912, "branch": "development", "commit": "0bf4012d16a74361500dad806d120a556fbbfd9b", "status": "FAILURE" }
    ],
    "preservedProductWorktree": {
      "path": "C:/repos/OrderApp/.worktrees/feature-sprint4-identity-design",
      "branch": "feature/sprint4-identity-design",
      "commit": "5c0e1ab136f477127ce194426742a27d704d20d4"
    },
    "authoritativeDevelopmentDeployment": {
      "workflowRun": 33457927112,
      "commit": "fbc68a9f0e02923880c8a06162a8d7cda2afac38",
      "environment": "development",
      "artifact": "cloudordersd583431devacr.azurecr.io/cloudorders-migrations@sha256:dbce8f8c093c7781796dd35e785dc7703b906e394aef7d76920632f20a6fd87e",
      "jobExecution": "cloudorders-dev-migrations-mefmiwa",
      "migration": "AddCustomerProfileOwnershipExpand",
      "status": "SUCCESS"
    },
    "postMigrationBaseline": {
      "targetCommit": "4b9b946ca12562900684fe5d2d7106d7f38d08e7",
      "status": "PASS_WITH_ENVIRONMENT_FAILURE",
      "commands": {
        "restore": "PASS",
        "format": "PASS",
        "releaseBuild": { "status": "PASS", "warnings": 0, "errors": 0 },
        "bicepLint": "PASS",
        "bicepBuild": "PASS",
        "developmentParameters": "PASS",
        "testParameters": "PASS",
        "productionParameters": "PASS",
        "diffCheck": "PASS"
      },
      "solutionTests": {
        "architecture": { "passed": 24, "failed": 0, "total": 24 },
        "unit": { "passed": 13, "failed": 0, "total": 13 },
        "integration": { "passed": 73, "failed": 0, "total": 73, "docker": "AVAILABLE" }
      },
      "workflowSelfTests": {
        "status": "PASS",
        "passed": 54,
        "failed": 0,
        "host": "Windows PowerShell 5.1 / Pester 3.4"
      },
      "environmentFailures": [
        {
          "command": "pwsh -File ops/Test-SprintDelivery.ps1",
          "reason": "PowerShell 7 is not installed in this local environment; the repository-supported Windows PowerShell command passed the same 54 tests."
        }
      ]
    },
    "cutoverResult": "WORKFLOW_CUTOVER_COMPLETE",
    "nextAction": "Resume Sprint 4A work item 4A-4 (Owner-aware authorization)."
  }
}
